{
  "schema_version": "v1",
  "device_id": "esp32-bedroom-01",
  "boot_id": "123e4567-e89b-12d3-a456-426614174000",
  "sequence": 2,
  "measured_at": "2026-10-19T22:00:10Z",
  "timezone": "Asia/Ho_Chi_Minh",
  "time_sync_status": "synced",
  "median_p2p": [42, 55, 75, 100, 130, 170, 220, 280, 350, 420],
  "peak_p2p": [48, 65, 90, 120, 150, 200, 260, 320, 400, 480],
  "quality_flags": ["ok", "ok", "ok", "ok", "ok", "ok", "ok", "ok", "ok", "ok"]
}