{
  "schema_version": "v1",
  "device_id": "esp32-bedroom-01",
  "boot_id": "123e4567-e89b-12d3-a456-426614174000",
  "sequence": 4,
  "measured_at": "2026-10-19T22:00:30Z",
  "timezone": "Asia/Ho_Chi_Minh",
  "time_sync_status": "synced",
  "median_p2p": [40, 42, 41, 40, 43, 41, null, null, 40, 41],
  "peak_p2p": [45, 48, 46, 45, 50, 47, null, null, 44, 46],
  "quality_flags": ["ok", "ok", "ok", "ok", "ok", "ok", "missing", "missing", "ok", "ok"]
}